en	bn
A white box with a red cross.	একটি লাল ক্রসযুক্ত একটি সাদা বাক্স।
Bread dough cross hatched design	রুটি ময়দার ক্রস হ্যাচড ডিজাইন
White boundary lines on the tennis court.	টেনিস কোর্টে সাদা সীমানা লাইন।
waves forms behind the boat	তরঙ্গ নৌকা পিছনে ফর্ম
second floor balcony	দ্বিতীয় তল বারান্দা
fast food hot dogs and onion rings	ফাস্ট ফুড হট কুকুর এবং পেঁয়াজ রিং
Time date stamp is bottom right	সময় তারিখ স্ট্যাম্প নীচে ডান
12/22/2006 date stamp	12/22/2006 তারিখ স্ট্যাম্প
fine grey gravel under players' legs	খেলোয়াড়দের পায়ের নীচে জরিমানা ধূসর কঙ্কর
lamp stand light	বাতি স্ট্যান্ড আলো
a professional tennis court	একটি পেশাদার টেনিস কোর্ট
Tall date palm	লম্বা খেজুর
Dresser with dinosaur models on top	শীর্ষে ডাইনোসর মডেল সহ ড্র্রেসার
top of tennis court	টেনিস কোর্ট শীর্ষ
Woman dressed as a maiden at the fair	মেলায় প্রথম মেয়েটির পোশাক পরা মহিলা
characters apart on stage set	মঞ্চে সেট অক্ষর পৃথক
Chinese characters on the back of the truck	ট্রাকের পেছনে চীনা অক্ষর
fast blue and white train	দ্রুত নীল এবং সাদা ট্রেন
players name on his shirt	তার শার্টে খেলোয়াড়দের নাম
College baseball players on the field.	মাঠে কলেজ বেসবল খেলোয়াড়।
blue court on the ground	মাটিতে নীল কোর্ট
Two toasted English muffins on a plate.	একটি প্লেটে দুটি টোস্টেড ইংলিশ মাফিনস।
Bag on the cement block	সিমেন্ট ব্লকে ব্যাগ
flower on ice block	আইস ব্লকে ফুল
yellow tennis balls on court	কোর্টে হলুদ টেনিস বল
A person waiting to cross the street	রাস্তা পার হওয়ার অপেক্ষায় থাকা এক ব্যক্তি
tan colored brick block wall	ট্যান রঙিন ইট ব্লক প্রাচীর
A dark wooden cross with a small sign attached	একটি গাঢ় কাঠের ক্রস যার সাথে একটি ছোট চিহ্ন যুক্ত রয়েছে
A clock with cartoon characters on	কার্টুন চরিত্রগুলি সহ একটি ঘড়ি
rocky and rectangular block with openings on dirt	ময়লা উপর খোলার সঙ্গে পাথুরে এবং আয়তক্ষেত্রাকার ব্লক
adult on a tennis court	টেনিস কোর্টে প্রাপ্তবয়স্ক
Knives in a wooden block on the countertop.	কাউন্টারটপের একটি কাঠের ব্লকে ছুরিগুলি।
leg of the second person	দ্বিতীয় ব্যক্তির পা
awning for food stand	খাদ্য স্ট্যান্ড জন্য সজাগ
Knives in a wooden block behind the stove.	চুলার পিছনে কাঠের ব্লকে ছুরি।
a red newspaper stand	একটি লাল সংবাদপত্র স্ট্যান্ড
Brown block and white house with pitched black roof.	কালো ছাদযুক্ত ব্রাউন ব্লক এবং সাদা ঘর।
The train is traveling in fair weather	ট্রেনটি ন্যায্য আবহাওয়ায় ভ্রমণ করছে
fast food on white plate	সাদা প্লেটে ফাস্টফুড
air forces flag	বিমান বাহিনী পতাকা
some watery plant forms	কিছু জলযুক্ত উদ্ভিদ ফর্ম
curves of forms worn over shoes on snowboard	স্নোবোর্ডে জুতো পরে ফর্মের বক্ররেখা
woman sitting on a stone block	পাথরের ব্লকে বসে মহিলা 
black lamb second from right	ডান থেকে দ্বিতীয় মেষশাবক
blue wall of the court	কোর্টের নীল প্রাচীর
a wood night stand.	একটি কাঠ নাইট স্ট্যান্ড
the wall is cement block	প্রাচীর সিমেন্ট ব্লক
the court is dark blue	কোর্ট গাঢ় নীল
The man's black shadow on the court	কোর্টে লোকটির কালো ছায়া
Woman standing on tennis court	টেনিস কোর্টে দাঁড়িয়ে মহিলা
a music stand on a curb	একটি সংকোচনের উপর একটি সঙ্গীত স্ট্যান্ড
a weed growing up from the tennis court	টেনিস কোর্ট থেকে আগাছা বাড়ছে
The military plane has a cross on the tail.	সামরিক বিমানের লেজটিতে একটি ক্রস রয়েছে।
small food press on stove	চুলায় ছোট খাবার প্রেস
two bicyclists waiting to cross intersection	চৌরাস্তা পার হওয়ার অপেক্ষায় দুজন সাইকেল চালক
cross nailed to a wall	ক্রস একটি প্রাচীরে গাঁথা
Wooden butcher block on kitchen sink.	রান্নাঘরের বেসিন এর উপর কাঠের বুচার ব্লক
three black Japanese characters	তিনটি কালো জাপানি অক্ষর
microphone on angled stand	কোণযুক্ত স্ট্যান্ডে মাইক্রোফোন
Look of concentration on game players face	গেম খেলোয়াড়দের মুখের প্রতি একাগ্রতার চেহারা
blue cross on front of car	গাড়ির সামনে নীল ক্রস
the blue painted do not cross line on the train platform	নীল রঙে আঁকা ট্রেনের প্ল্যাটফর্মে লাইনটি অতিক্রম করে না
tennis match in progress on outdoor court	আউটডোর কোর্টে টেনিস ম্যাচ চলছে
Two men on a tennis court playing tennis	টেনিস খেলতে টেনিস কোর্টে দুজন লোক
wood block of knives	ছুরির কাঠের ব্লক
A block of brown stones.	বাদামী পাথর একটি ব্লক।
players' names in black on yellow background	হলুদ পটভূমিতে কালো রঙের প্লেয়ারদের নাম
an off white set of box springs	বক্স স্প্রিংস একটি সাদা সাদা সেট
Blue characters on a white background	একটি সাদা পটভূমিতে নীল অক্ষর
TV on the stand.	স্ট্যান্ডে টিভি।
Yellow ball on the court.	কোর্টে হলুদ বল।
Electrical wire stand	বৈদ্যুতিক তারের স্ট্যান্ড
cross made of stone	পাথরের তৈরি ক্রস
The traffic light has a red cross.	ট্র্যাফিক লাইটের একটি রেড ক্রস রয়েছে।
ball on a tennis court	টেনিস কোর্টে বল
cross walk area painted on the street	রাস্তায় আঁকা ক্রস ওয়াক এরিয়া
Brown stand holding bananas.	কলা বাদামী স্ট্যান্ড।
the line that shows foul or fair	লাইনটি অশ্লীল বা ফর্সা দেখায়
Knob above knife block	ছুরি ব্লক উপরে গিঁট
A time stamp on a video.	একটি ভিডিওতে টাইম স্ট্যাম্প।
a clock on a glass stand	কাচের স্ট্যান্ডের একটি ঘড়ি
One person on the court	কোর্টে একজন ব্যক্তি
Road block submerged by water	জলে নিমজ্জিত রোড ব্লক
tennis court floor is blue	টেনিস কোর্ট ফ্লোর নীল
baseball players signing autographs	বেসবল খেলোয়াড় অটোগ্রাফ স্বাক্ষর
fine metal safety netting	সূক্ষ্ম ধাতু সুরক্ষা জাল
An audience witnessing a press conference	এক সংবাদ সম্মেলনের সাক্ষী শ্রোতা
players in team dugout	টীম ডাগআউট এ খেলোয়াড়রা
white frisbee in players hands	খেলোয়াড়দের হাতে সাদা ফ্রিসবি
time and date stamp	সময় এবং তারিখ স্ট্যাম্প
A TV stand	একটি টিভি স্ট্যান্ড
The time stamp display window on the meter on the left.	বামদিকে মিটারে সময় স্ট্যাম্প প্রদর্শন উইন্ডো।
a wooden block of knives	ছুরি একটি কাঠের ব্লক
a second story railing	একটি দ্বিতীয় গল্প রেলিং
This is a picture of Chinese characters	এটি চাইনিজ চরিত্রগুলির একটি ছবি
fast super jet hovers in the sky	দ্রুত সুপার জেট আকাশে ঘোরাফেরা করে
the players are moving	খেলোয়াড়রা চলাফেরা করছে
two guys in the background are observing the movements of the players	পটভূমির দু'জন খেলোয়াড় খেলোয়াড়দের চলন পর্যবেক্ষণ করছে 
Curled metal legs on a candle stand	একটি মোমবাতি স্ট্যান্ডের উপর কার্ল ধাতব পা
two players watching the batter	দুই খেলোয়াড় ব্যাটার দেখছেন
fine white spray against nose of craft	নৈপুণ্যের নাকের বিরুদ্ধে সূক্ষ্ম সাদা স্প্রে
Brown tennis court floor	ব্রাউন টেনিস কোর্ট ফ্লোর
cross on top of church	গির্জার উপরে ক্রস
copyright and date	কপিরাইট এবং তারিখ
A sign for the 550 west block of Bliss Ct.	ব্লিস সিটি-এর 550 পশ্চিম ব্লকের জন্য একটি চিহ্ন।
Opponent Reaching Out to block	প্রতিপক্ষ ব্লক করতে পৌঁছেছে
Laptop on a stand	একটি স্ট্যান্ডে ল্যাপটপ
a wooden block sitting on the table	টেবিলের উপর বসে একটি কাঠের ব্লক
Part of the tennis court is green.	টেনিস কোর্টের কিছু অংশ সবুজ।
two players in orange and white sitting on sidelines	কমলা এবং সাদা দুই খেলোয়াড় সাইড লাইনে বসে on
date stamp of photo	ছবির তারিখ স্ট্যাম্প
a pole of a lamp stand	একটি বাতি স্ট্যান্ডের একটি খুঁটি
the door of second floor is brown	দ্বিতীয় তলার দরজাটি বাদামী
Front wheel on second white truck.	দ্বিতীয় সাদা ট্রাকে সম্মুখ চাকা।
the second gold horse	দ্বিতীয় সোনার ঘোড়া
A small grey block on the median	মিডিয়ানের উপর একটি ছোট ধূসর ব্লক
Woman on a tennis court	টেনিস কোর্টে মহিলা
red characters on top of blue building	নীল ভবনের উপরে লাল অক্ষর
the collar decoration of a fair isle type sweater	ফেয়ার আইল টাইপের সোয়েটারের কলার সজ্জা
Woman wearing a cross on her neck	গলায় ক্রস পরা মহিলা
a colorful display lighted characters	একটি বর্ণময় প্রদর্শন আলোকিত অক্ষর
The second train car	দ্বিতীয় ট্রেনের গাড়ি
the players arm is ready to throw	খেলোয়াড়দের হাত ছুঁড়ে ফেলার জন্য প্রস্তুত
date and time stamp in corner	কোণে তারিখ এবং সময় স্ট্যাম্প
Two characters on the television	টেলিভিশনে দুটি চরিত্র
blue net around tennis court	টেনিস কোর্ট কাছাকাছি নীল নেট
a block paved sidewalk	একটি ব্লক প্রশস্ত ফুটপাথ
a orange bottle in stand	স্ট্যান্ডে কমলা বোতল
The items of the second rack	দ্বিতীয় রাকের আইটেম
tan grey fine sand	ট্যান ধূসর সূক্ষ্ম বালি
fence in back of the court	কোর্টের পিছনে বেড়া
five glass vases on the stand	স্ট্যান্ডে পাঁচটি কাচের ফুলদানি
white Asian language characters painted on middle of street	রাস্তার মাঝখানে আঁকা সাদা এশিয়ান ভাষার অক্ষর
second leaf from left	বাম থেকে দ্বিতীয় পাতা
white fast logo in corner	কোণে সাদা দ্রুত লোগো
a large concrete block	একটি বড় কংক্রিট ব্লক
a player on second base	দ্বিতীয় বেস একটি প্লেয়ার
fondant characters on cake	কেক উপর অনুরাগী চরিত্র
grey characters on a sign	একটি চিহ্ন উপর ধূসর অক্ষর
Red tie with Peanuts characters	চিনাবাদামের অক্ষরগুলির সাথে লাল টাই
press here sticker on paw	পাঞ্জা এখানে স্টিকার প্রেস
a sign in a zoo, written in catalan - spanish – english	চিড়িয়াখানায় একটি চিহ্ন, নিখুঁত - স্প্যানিশ - ইংরেজি লেখা
White letters and numbers, indicating date and photographer.	শ্বেত অক্ষর এবং সংখ্যা, ইঙ্গিত করে তারিখ এবং ফটোগ্রাফার।
window on second level	দ্বিতীয় স্তরের উইন্ডো
yellow date and time stamp	হলুদ তারিখ এবং সময় স্ট্যাম্প
players playing base ball on field	খেলোয়াড়রা মাঠে বেস বল খেলছেন
a black fine tooth comb	একটি কালো সূক্ষ্ম দাঁত চিরুনি
a second daybed in room	রুমে একটি দ্বিতীয় দিন
lots of kick+grab marks on white wall below blurry words of graffiti [likely not in english]	গ্রাফিতির অস্পষ্ট শব্দের নীচে সাদা দেয়ালে প্রচুর কিক + দখল চিহ্ন [সম্ভবত ইংরেজিতে নয়]
people enjoying themselves at the fair	মানুষ মেলায় নিজেকে উপভোগ করছে
bananas and oranges on fruit stand	কলা এবং কমলা ফলের স্ট্যান্ডে
A small food stand on wheels.	চাকা উপর একটি ছোট খাবার স্ট্যান্ড।
fine china plate with gold rim	সোনার রিম দিয়ে সূক্ষ্ম চীনার প্লেট
a white alarm clock is on top of the night stand	নাইট স্ট্যান্ডের উপরে একটি সাদা অ্যালার্ম ঘড়ি রয়েছে
baseball players sitting in dugout	বেসবল খেলোয়াড় dugout বসে
letter on the wood block	কাঠের ব্লকে চিঠি
Two butcher block knive sets.	দুটি কসাই ব্লক নাইভ সেট।
A sideways rendered date stamp	পার্শ্ববর্তী স্থানে তারিখের স্ট্যাম্প রেন্ডার করা
White second story porch	সাদা দ্বিতীয় গল্প বারান্দা
a door on the side of the court	দরজার পাশের একটি দরজা
a block defining the space for the bench	বেঞ্চের জন্য স্থান নির্ধারণকারী একটি ব্লক
block of white text	সাদা পাঠ্য ব্লক
a brown cat is stand	একটি বাদামী বিড়াল স্ট্যান্ড হয়
A train is going very fast	একটি ট্রেন খুব দ্রুত চলছে
Red and white Stop sign with characters in a non-English language	অ-ইংরাজী ভাষায় অক্ষরগুলির সাথে লাল এবং সাদা স্টপ সাইন
the shin guard on the players leg	খেলোয়াড়দের পায়ে শিন গার্ড
A tennis player standing in the court	একটি টেনিস খেলোয়াড় কোর্টে দাঁড়িয়ে
women waiting to cross	ক্রস করার অপেক্ষায় মহিলারা
blue tennis court with painted white boundary lines	আঁকা সাদা সীমানা লাইন দিয়ে নীল টেনিস কোর্ট
white asphalt with fine lines	সূক্ষ্ম লাইনের সাথে সাদা ডামাল
date the photo was taken	তারিখটি ছবি তোলা হয়েছিল
block of cheese on plate	প্লেটে পনির ব্লক
They both are playing on a tennis court.	তারা দুজনেই টেনিস কোর্টে খেলছেন।
leaves on tennis court	টেনিস কোর্ট ছেড়ে
a cross street sign	একটি ক্রস রাস্তার চিহ্ন
the net across their court	তাদের কোর্ট জুড়ে নেট
geyer springs street sign	জিয়ার স্প্রিংস রাস্তার চিহ্ন
couple guys walking on tennis court	টেনিস কোর্টে হাঁটা দম্পতি
wooden cross hanging on a wall	একটি দেয়ালে ঝুলন্ত কাঠের ক্রস
cross structures for bridge support	ব্রিজ সমর্থন জন্য ক্রস কাঠামো
boy standing on tennis court	টেনিস কোর্টে দাঁড়িয়ে ছেলে
Banana shaped yellow banana stand	কলা আকারের হলুদ কলা স্ট্যান্ড
A person below the date	তারিখের নীচে একজন ব্যক্তি
green tennis court with white lines	সাদা লাইন সঙ্গে সবুজ টেনিস কোর্ট
man stand on skateboard	মানুষ স্কেটবোর্ডে দাঁড়িয়ে আছে
The front wheel of the second bus.	দ্বিতীয় বাসের সামনের চাকা।
Bizarre sculpture on a coffee stand	একটি কফি স্ট্যান্ডে উদ্ভট ভাস্কর্য
large cement block	বড় সিমেন্ট ব্লক
this stand is yellow in color	এই স্ট্যান্ডটি হলুদ বর্ণের
date stamp of scene	দৃশ্যের তারিখ স্ট্যাম্প
Propellers too fast to see.	প্রোপেলাররা দেখতে খুব দ্রুত।
a block, yellow, and white baseball uniform	একটি ব্লক, হলুদ এবং সাদা বেসবল ইউনিফর্ম
players shoes are black, red, and white	খেলোয়াড়ের জুতা কালো, লাল এবং সাদা
The players are giving a high five	খেলোয়াড়রা উচ্চ পাঁচজন দিচ্ছেন
person has a stamp on her hand	ব্যক্তির হাতে একটি স্ট্যাম্প আছে
Copy right date 2010	সঠিক তারিখ 2010 অনুলিপি করুন
low grey wall behind players	খেলোয়াড়দের পিছনে কম ধূসর প্রাচীর
a green part of a tennis court.	টেনিস কোর্টের সবুজ অংশ।
the second street light	দ্বিতীয় স্ট্রিট লাইট
Two tennis players standing together	দুই টেনিস খেলোয়াড় একসাথে দাঁড়িয়ে
two tennis players wearing black shorts	কালো শর্টস পরা দুই টেনিস খেলোয়াড়
the players socks are blue	প্লেয়ার মোজা নীল হয়
A red date stamp	একটি লাল তারিখ স্ট্যাম্প
Monitor stand below monitor	মনিটরের মনিটরের নীচে স্ট্যান্ড করুন
a manual press machine	একটি ম্যানুয়াল প্রেস মেশিন
long black pipe on display stand	ডিসপ্লে স্ট্যান্ডে দীর্ঘ কালো পাইপ
male cross country skier	পুরুষ ক্রস কান্ট্রি স্কিয়ার
models of airplanes on the tables	টেবিলগুলিতে বিমানের মডেল
Man cross country skiing.	ম্যান ক্রস কান্ট্রি স্কিইং।
the sign has white characters	চিহ্নটিতে সাদা বর্ণ রয়েছে
red time stamp on the photo	ছবির উপর লাল সময় স্ট্যাম্প
little girl standing on a tennis court	টেনিস কোর্টে দাঁড়িয়ে ছোট মেয়ে
man cross country skiing during race	ম্যান ক্রস কান্ট্রি স্কিইং রেসের সময়
Cement forms sticking out of ground.	সিমেন্ট ফর্ম স্থল থেকে দূরে থাকে।
Sandwich on the second shelf.	দ্বিতীয় বালুচরে স্যান্ডউইচ।
the english muffins are toasted	ইংলিশ মাফলিন টোস্ট করা হয়
yellow front of second train	দ্বিতীয় ট্রেনের হলুদ সামনে
models posing on motorcycle	মডেল মোটরসাইকেলের উপর অঙ্গবিন্যাস
This open-air stand takes place in Jamaica	এই ওপেন-এয়ার স্ট্যান্ডটি জামাইকাতে স্থান নেয়
clear stand for controller	নিয়ামক জন্য স্পষ্ট অবস্থান
black armed forces name on wing	কালো সশস্ত্র বাহিনীর নাম উইংয়ে
second base found directly behind the pitcher	কলসিটির পিছনে সরাসরি দ্বিতীয় বেস পাওয়া যায়
A cross on a tower.	একটি টাওয়ারের উপরে একটি ক্রস।
picture taken at drive up fast food chain	ড্রাইভ আপ ফাস্ট ফুড চেইন ছবি
two horses stand on hill	দুটি ঘোড়া পাহাড়ে দাঁড়িয়ে আছে
cross centered in curved panels	বক্র প্যানেল কেন্দ্রিক ক্রস
white stripes in road is a pedestrian cross walk	রাস্তায় সাদা স্ট্রাইপগুলি একটি পথচারী ক্রস হাঁটা
Box springs of bed.	বিছানা বক্স স্প্রিংস।
The water bottle on the side of the court.	কোর্টের পাশে জলের বোতল 
A small wave forms on the water.	জলের উপর একটি ছোট তরঙ্গ গঠন করে।
a daytime picture of a couple cross country skiing	একটি দম্পতি ক্রস কান্ট্রি স্কিইংয়ের একটি দিনের চিত্র
