en	bn
Cars moving at a very fast speed	গাড়িগুলি খুব দ্রুত গতিতে চলেছে
a tree on a city block	একটি শহরের ব্লকের একটি গাছ
a cement block wall	একটি সিমেন্ট ব্লক প্রাচীর
computer monitor on the stand	স্ট্যান্ডে কম্পিউটার মনিটর
snow on the trees at a cross-country ski race	ক্রস-কান্ট্রি স্কি রেসে গাছগুলিতে তুষার
the second engine of the train	ট্রেনের দ্বিতীয় ইঞ্জিন
a black music stand	একটি কালো সঙ্গীত স্ট্যান্ড
chairs and tables on the side of the court	কোর্টের পাশে চেয়ার এবং টেবিল
Baseball travelling fast in the air	বেসবল দ্রুত বাতাসে ভ্রমণ করে
fast food soda cups	ফাস্ট ফুড সোডা কাপ
An old wooden stand shade	একটি পুরানো কাঠের স্ট্যান্ড শেড
red on players sleeve	খেলোয়াড়দের হাতা উপর লাল
a stand next to the sink	বেসিন এর পাশে একটি স্ট্যান্ড
second hand on clock	ঘড়ির উপর সেকেন্ডের কাঁটা
four men on court	কোর্টে চার জন
a block wall behind the man	লোকটির পিছনে একটি ব্লক প্রাচীর
cross walk at intersection	চৌরাস্তা ক্রস ওয়াক
large tennis court	বড় টেনিস কোর্ট
Child sitting cross-legged on the floor	বাচ্ছাটি মেঝেতে পা ভাঁজ করে বসে আছে 
Man standing on a tennis court	টেনিস কোর্টে দাঁড়িয়ে মানুষ
yellow time date stamp	হলুদ সময় তারিখ স্ট্যাম্প
Turnstyle entrance to court	কোর্টে টার্নস্টাইল প্রবেশ
horse running fast with cowboy on the back	পেছনে কাউবয় সঙ্গে দ্রুত ঘোড়া
blue umbrella pole held fast by sand	নীল ছাতা মেরুটি বালি দ্বারা ধরে রাখা
blue wood life guard stand	নীল কাঠের লাইফ গার্ড স্ট্যান্ড
gloves are in the players back pocket	গ্লাভস প্লেয়ারদের পিছনে পকেটে রয়েছে
seats in the stand	স্ট্যান্ডে আসন
the players glove is black	খেলোয়াড়দের গ্লোভ কালো
a brown horse with an english saddle	একটি ইংরেজী জিনযুক্ত একটি বাদামী ঘোড়া
The canvas sits on the stand	ক্যানভাস স্ট্যান্ডে বসে
a camera on a stand	একটি স্ট্যান্ডে একটি ক্যামেরা
net of the tennis court	টেনিস কোর্ট নেট
man sitting in fruit stand	মানুষ ফলের স্ট্যান্ডে বসে
grill press	গ্রিল প্রেস
cross on tower steeple	টাওয়ার স্টেপল উপর ক্রস
ink stamp in the pencil box	পেন্সিল বাক্সে কালি স্ট্যাম্প
small table lamp on the night stand	নাইট স্ট্যান্ডে ছোট টেবিল ল্যাম্প
series of curved forms around body	শরীরের চারপাশে বাঁকা ফর্ম সিরিজ
a clock on a wooden block	কাঠের ব্লকের একটি ঘড়ি 
edge of a stamp	একটি স্ট্যাম্প প্রান্ত
a man sitting cross legged in the grass	একটি লোক ঘাসে পা ভাঁজ করে বসেছে
Right ear of the second cat	দ্বিতীয় বিড়ালের ডান কান
a fine bristled retractable brush	একটি সূক্ষ্ম ব্রিসলেড প্রত্যাহারযোগ্য ব্রাশ
A motorcyclist driving very fast	একজন মোটরসাইকেল চালক খুব দ্রুত গাড়ি চালাচ্ছেন
a baseball players bat	একটি বেসবল খেলোয়াড় ব্যাট
A second sandwich on a wrapper.	একটি মোড়কের উপর একটি দ্বিতীয় স্যান্ডউইচ।
case with cross on it also has red trim	এটি ক্রস সঙ্গে কেস এছাড়াও লাল ছাঁটাই আছে
a railing on a second story balcony	দ্বিতীয় তলের বারান্দায় একটি রেলিং
Two soccer players	দুই ফুটবল খেলোয়াড়
the cross on the top of the building structure	বিল্ডিং কাঠামো শীর্ষে ক্রস
People waiting to cross street	রাস্তা পার হওয়ার অপেক্ষায় থাকা মানুষ
characters on the sign	সাইন অক্ষর
A skateboard with asian characters painted on the underside	আন্ডারসাইডে আঁকা এশিয়ান অক্ষর সহ একটি স্কেটবোর্ড
fine inscriptions on item	আইটেম উপর সূক্ষ্ম শিলালিপি
characters are posted in Chinese	অক্ষরগুলি চীনা ভাষায় পোস্ট করা হয়
Man getting ready for a penalty kick	পেনাল্টি কিকের জন্য প্রস্তুত মানুষ
A red cross forms on the floor.	মেঝেতে একটি লাল ক্রস গঠন।
many wires criss-cross overhead	অনেক তারের ক্রাইস-ক্রস ওভারহেড
This could be at a science fair.	এটি একটি বিজ্ঞান মেলায় হতে পারে।
man using a hand press to make juice	মানুষ রস তৈরি করতে একটি হাত প্রেস ব্যবহার করে
The picture has a date stamp	ছবিটিতে একটি তারিখের স্ট্যাম্প রয়েছে
A date underneath a clock face	একটি ঘড়ির মুখের নীচে একটি তারিখ
unfinished wood block under freezer	ফ্রিজারের অধীনে অসম্পূর্ণ কাঠের ব্লক
fast train moving along track	দ্রুত ট্রেন ট্র্যাক বরাবর চলমান
Three baseball players wearing white uniforms are in the background.	সাদা ইউনিফর্ম পরা তিনটি বেসবল খেলোয়াড় পটভূমিতে রয়েছে।
tennis player on the green colored section of a court	একটি কোর্টের সবুজ বর্ণের বিভাগে টেনিস খেলোয়াড়
making a very fast turn	খুব দ্রুত পালা করা
the tennis court net divides the court in the middle	টেনিস কোর্ট নেট মাঝখানে কোর্ট বিভক্ত
4 players on the court	কোর্টে ৪ জন খেলোয়াড়
the chinese characters on the vase	দানি উপর চীনা অক্ষর
crumbly english muffin bread	ঝুরঝুরে ইংলিশ মাফিন রুটি
a stand with information	তথ্য সহ একটি স্ট্যান্ড
ad on the wall of the court	কোর্টের দেয়ালে বিজ্ঞাপন
The right front window on the second level of the bus.	বাসের দ্বিতীয় স্তরের ডান সামনের জানালা
the Asian characters are red	এশীয় চরিত্রগুলি লাল
block tower on top of hill	পাহাড়ের উপরে ব্লক টাওয়ার
The black baseball mit on the players hand	খেলোয়াড়দের হাতে কালো বেসবল মিট
yellow cross on a tie	একটি টাই উপর হলুদ ক্রস
five baseball players	পাঁচ বেসবল খেলোয়াড়
large date palm in the distance	দূরত্বে বড় খেজুর
Cows laying down in the hay at a county fair	কাউন্টি মেলায় খড়ের গায়ে শুয়ে গাভী
armed forces identifying patch for US Army	সশস্ত্র বাহিনী মার্কিন সেনাবাহিনীর জন্য প্যাচ চিহ্নিত করে
The tennis court is two different colors.	টেনিস কোর্ট দুটি ভিন্ন রঙ।
A indoor tennis court.	একটি ইনডোর টেনিস কোর্ট।
characters on the edge of the plate	প্লেটের প্রান্তে অক্ষর
a fruit stand with lots of fruits and vegetables	প্রচুর ফল এবং সবজি সহ একটি ফল স্ট্যান্ড 
red white and blue truck is at the fair	লাল সাদা এবং নীল ট্রাক মেলায়
yellow date taken stamp	হলুদ তারিখ নেওয়া স্ট্যাম্প
Tarp on the side of the court	কোর্টের পাশে টার্প
Tall lights at the court	দরবারে লম্বা লাইট
players standing behind chain link fence	চেইন লিঙ্ক বেড়া পিছনে দাঁড়িয়ে খেলোয়াড়রা
date stamp in the corner	কোণে তারিখ স্ট্যাম্প
a cross in a church	একটি গির্জার ক্রস
easel stand for painting	পেইন্টিং জন্য ইজিল স্ট্যান্ড
owners manual for a panini press	একটি পানিনি প্রেসের জন্য মালিকদের ম্যানুয়াল
dog forms splashes in the water	কুকুর জল ছেটাচ্ছে
two long and narrow panes below cross bar	ক্রস বারের নীচে দুটি দীর্ঘ এবং সরু ফলক
Double red doors on second floor	দ্বিতীয় তলায় ডাবল লাল দরজা
Partial view of second bus	দ্বিতীয় বাসের আংশিক দৃশ্য
White door on second floor	দ্বিতীয় তলায় সাদা দরজা
a romantic date night	একটি রোমান্টিক তারিখ রাত
knife block sitting on counter with knives in it	এটিতে ছুরি নিয়ে কাউন্টারে বসে চাকু ব্লক
a block of buildings	বিল্ডিং একটি ব্লক
Curved stairs on the approach to the court yard	কোর্ট ইয়ার্ডে যাওয়ার জন্য বাঁকানো সিঁড়ি
chinese characters on the side of a bus	একটি বাসের পাশে চীনা অক্ষর
blue tennis court	নীল টেনিস কোর্ট
This person is waiting to cross the street	এই ব্যক্তি রাস্তায় পারাপারের জন্য অপেক্ষা করছেন
The block for the post	পোস্টের জন্য ব্লক
tan letters on the tennis court	টেনিস কোর্টে ট্যান চিঠি
this license plate has non-english characters	এই লাইসেন্স প্লেটে অ-ইংরেজি অক্ষর রয়েছে
players uniform is black and gold	খেলোয়াড়দের ইউনিফর্মটি কালো এবং সোনার
Watermark, showing copyright date.	ওয়াটারমার্ক, কপিরাইটের তারিখ দেখাচ্ছে।
name and website of photographer and Chinese characters	নাম এবং ফটোগ্রাফার এবং চীনা অক্ষর ওয়েবসাইট
tv on a stand	স্ট্যান্ডে টিভি
grass grows next to the block	ব্লকের পাশে ঘাস জন্মে
A paper towel roll on a stand	একটি স্ট্যান্ডে একটি কাগজের তোয়ালে রোল
white springs under mattress	গদিতে সাদা ঝর্ণা
The brick wall behind the court	কোর্টের পিছনে ইটের দেয়াল
egg shaped object on a stand	স্ট্যান্ডে ডিমের আকারের বস্তু
tennis ball shadow on the court	কোর্টে টেনিস বল ছায়া
littleyiye photographers stamp	ছোট্টই ফটোগ্রাফারদের স্ট্যাম্প
Picture stamped date 8/10/2013.	ছবি স্ট্যাম্পড তারিখ 8/10/2013।
2010 date in black	২০১০ তারিখে কালো
sign above the people at the fair	মেলায় লোকদের উপরে সাইন ইন করুন
Straight fine black hair	সোজা সূক্ষ্ম কালো চুল
a horse with an english saddle	একটি ইংরেজী জিনযুক্ত একটি ঘোড়া
the baby has very fine hair	শিশুর খুব সুন্দর চুল রয়েছে has
pelican forms ripples with legs	পেলিকান পায়ে দিয়ে রিপ্লেস গঠন করে
A window on a second story shop.	দ্বিতীয় গল্পের দোকানে একটি উইন্ডো।
Green stand in the snow.	বরফে সবুজ স্ট্যান্ড।
display models of cell phones	সেল ফোন মডেল প্রদর্শন
black chinese characters n white sign	কালো চীনা অক্ষর এন হোয়াইট সাইন
Shadow of the man on the tennis court	টেনিস কোর্টে লোকটির ছায়া
white marking on tennis court	টেনিস কোর্টে সাদা চিহ্ন
Baby fine light brown hair.	বাবু সূক্ষ্ম হালকা বাদামী চুল।
the players lean on the fence	খেলোয়াড়দের বেড়া উপর ঝুঁকুন
second suitcase on bottom is orange	নীচে দ্বিতীয় স্যুটকেস কমলা হয়
Man helping child stand on snowboard	শিশু স্নোবোর্ডে দাঁড়াতে সহায়তা করে লোক
extremely fast bullet train	অত্যন্ত দ্রুত বুলেট ট্রেন
Oriole on front of players hat	ওরিওল খেলোয়াড়দের সামনে টুপি
Net across the tennis court	টেনিস কোর্ট জুড়ে নেট
second car parked on the street	দ্বিতীয় গাড়ী রাস্তায় পার্ক
Cather's mit for hand protection against fast pitches.	দ্রুত পিচের বিরুদ্ধে হাত রক্ষার জন্য ক্যাথার মিট।
fast food chicken patty	ফাস্ট ফুড মুরগির প্যাটি
sunglasses of second rider	দ্বিতীয় রাইডারের সানগ্লাস
People buying food on fast food store	লোকেরা ফাস্টফুড স্টোরে খাবার কিনে থাকে
second animal in the back	পিছনে দ্বিতীয় প্রাণী
the stand under the tv	টিভির নীচে স্ট্যান্ড
tennis court with white stripes	সাদা ফিতে সঙ্গে টেনিস কোর্ট
kick stand on motorcycle	মোটরসাইকেলের উপর কিক স্ট্যান্ড
chainlink fencing forms a field exit	চেইনলিংক বেড়া একটি ক্ষেত্র প্রস্থান করে
Wall design of people characters.	মানুষের চরিত্রগুলির ওয়াল ডিজাইন।
the sidewalk in front of the produce stand	উত্পাদনের স্ট্যান্ডের সামনের ফুটপাত
concrete or cinder block walls	কংক্রিট বা সিন্ডার ব্লক দেয়াল
The tv stand is made of wood	টিভি স্ট্যান্ডটি কাঠের তৈরি
the models perky lips	মডেল বেহায়া ঠোঁট
Three baseball players at first base	প্রথম বেসে তিনটি বেসবল খেলোয়াড়
block of black butcher knives	কালো কসাই ছুরি ব্লক
pointing sign in english and chinese	ইংরাজী এবং চীনা মধ্যে সাইন ইন
Lamp on the night stand to the left of the bed	বিছানার বাম দিকে নাইট স্ট্যান্ডে প্রদীপ
Date stamp of March 16th, 2008	16 শে মার্চ, 2008 তারিখের ডাকটিকিট
coca cola international logo, written in english, probably repeated below	কোকা কোলা আন্তর্জাতিক লোগো, ইংরেজিতে লেখা, সম্ভবত নীচে পুনরাবৃত্তি হয়েছে
a white sign with black Asian characters going vertically	কালো এশিয়ান অক্ষরগুলির সাথে একটি সাদা চিহ্ন 
bicycle stamp on road	রাস্তায় সাইকেল স্ট্যাম্প
neon sign in a second floor window	দ্বিতীয় তল উইন্ডোতে নিয়ন সাইন
this couple is on a date	এই দম্পতি একটি তারিখে হয়
Mcdonald's advertisement in a language other than english	ইংরাজী ছাড়া অন্য ভাষায় ম্যাকডোনাল্ডের বিজ্ঞাপন
rolls of towels on stand	তোয়ালে রোল স্ট্যান্ডে
many glorious forms of opportunistic weeds	সুবিধাবাদী আগাছা অনেক গৌরবময় ফর্ম
kids at a fair eating	বাচ্চাদের ন্যায্য খাওয়ার সময়
a block lower half of a wall	একটি দেয়ালের নীচে অর্ধেক ব্লক
jelly jar on top of a chopping block	কাটা ব্লকের উপরে জেলি জার
yellow poles by the cross sign	ক্রস চিহ্ন দ্বারা হলুদ খুঁটি
orange time and date stamp	কমলা সময় এবং তারিখ স্ট্যাম্প
Two female tennis players shaking hands	দুই মহিলা টেনিস খেলোয়াড় হাত কাঁপছেন
A wooden stand	একটি কাঠের স্ট্যান্ড
Four baseball players on field.	মাঠে চার বেসবল খেলোয়াড়।
an American flag in the background of a press conference	একটি সংবাদ সম্মেলনের পটভূমিতে একটি আমেরিকান পতাকা
two english spaniels standing near a person	একজন ব্যক্তির কাছে দাঁড়িয়ে দুটি ইংলিশ স্প্যানিয়াল দাঁড়িয়ে
There is a book stand that is filled with books.	বইয়ের স্ট্যান্ড রয়েছে যা বই ভর্তি রয়েছে।
man taking pictures of players	মানুষ খেলোয়াড়দের ছবি তুলছে
Black hat with a red cross	একটি লাল ক্রস সঙ্গে কালো টুপি
three baseball players standing in a row	তিনটি বেসবল খেলোয়াড় একটি সারিতে দাঁড়িয়ে
A black and brown dog fast asleep on the couch.	একটি কালো এবং বাদামী কুকুর দ্রুত পালঙ্কে ঘুমিয়ে আছে।
the time stamp sitting in the corner	সময় স্ট্যাম্প কোণে বসে
yellow plane with characters	অক্ষরের সাথে হলুদ বিমান
Buttons for pedestrians to cross the street	রাস্তা পার হওয়ার জন্য পথচারীদের জন্য বোতাম t
A stand mixer	একটি স্ট্যান্ড মিশুক
this players is shirtless	এই খেলোয়াড়রা শার্ট ছাড়া আছে
pattern on side of second giraffe	দ্বিতীয় জিরাফ পাশের প্যাটার্ন
a block on the ground	মাটিতে একটি ব্লক
bicycles in stand	সাইকেল দাঁড়ানো
a man photographs two baseball players	একজন লোক দুই বেসবল খেলোয়াড়ের ছবি
a red don't cross signal.	একটি লাল ক্রস সংকেত না।
French coffee press	ফ্রেঞ্চ কফি প্রেস
black bicycle seat with supporting springs	সমর্থনকারী স্প্রিংস সহ কালো সাইকেল আসন
propeller is moving fast	প্রোপেলার দ্রুত এগিয়ে চলেছে
toy models of buses	খেলনা মডেল বাস
a motorcycle going fast	একটি মোটরসাইকেল দ্রুত যাচ্ছে
Shadow on the court	কোর্টে ছায়া
A brick wall separating players and spectators.	খেলোয়াড় এবং দর্শকদের পৃথককারী একটি ইটের প্রাচীর।
a fast moving hand	একটি দ্রুত চলন্ত হাত
The night stand is wooden.	নাইট স্ট্যান্ডটি কাঠের।
baseball players posing together in an old photograph	বেসবল খেলোয়াড়রা পুরানো ছবিতে একসাথে পোজ দিচ্ছেন
Net across tennis court	টেনিস কোর্ট জুড়ে নেট
glass top on night stand	নাইট স্ট্যান্ডে গ্লাস টপ
raised cross on top of remote control	রিমোট কন্ট্রোল শীর্ষে উত্থিত ক্রস
Grass growing on the grass tennis court.	ঘাস টেনিস কোর্টে বাড়ছে ঘাস।
time stamp on the picture	ছবিতে সময় স্ট্যাম্প
two red metal springs	দুটি লাল ধাতুর ঝর্ণা
a a block in a wall	একটি দেয়ালে একটি ব্লক
People looking to cross the road.	লোকেরা রাস্তা পার হতে দেখছে।
the fair sky	ফর্সা আকাশ
a motorcycle is parked in front of the road block	একটি মোটরসাইকেল রাস্তা ব্লকের সামনে দাঁড়িয়ে আছে
White striped pedestrian cross-walk painted on street.	রাস্তায় সাদা স্ট্রিপযুক্ত পথচারী ক্রস-ওয়াক আঁকা।
Baseball team players in the dugout	ডাগআউটে বেসবল দলের খেলোয়াড়রা
boy sitting cross legged	ছেলে টি হাঁটু ভাঁজ করে বসে
The man's hand forms a fist	লোকটির হাত মুঠো হয়েছে
stand of bamboo	বাঁশের স্ট্যান্ড
Statue honoring members of the armed forces	সশস্ত্র বাহিনীর সদস্যদের সম্মান জানিয়ে প্রতিমা
men of forces wearing the dress uniforms	ইউনিফর্ম পোষাক পরা পুরুষদের বাহিনী 
Another stand and its owner	আরেকটি স্ট্যান্ড এবং এর মালিক
A man stand next to a jeep.	একটা লোক জিপের পাশে দাঁড়িয়ে আছে।
The sign that says Alice springs	সাইন এ এলিস স্প্রিংস লেখা
a sandwich on a block	একটি ব্লকের উপর একটি স্যান্ডউইচ
red bags behind players feet	খেলোয়াড়দের পায়ের পিছনে লাল ব্যাগ
Asian characters on side of building	বিল্ডিংয়ের পাশে এশীয় অক্ষর
The tennis player's shadow is on the tennis court.	টেনিস কোর্টে টেনিস খেলোয়াড়ের ছায়া।
fast looking yellow motorcycle	দ্রুত গতির মোটর সাইকেল
