en	bn
white springs under bed	বিছানার নিচে সাদা স্প্রিংগুলো 
a sponsors name on the tennis court wall	টেনিস কোর্ট প্রাচীর একটি স্পনসর নাম
Asian characters written on a sign	একটি চিহ্নে লেখা এশীয় অক্ষর
the date and time indicating the time of picture	তারিখ এবং সময় ছবির সময় নির্দেশ করে
The light forms a rainbow	আলো একটি রংধনু গঠন করে
Headpiece of the second rider from the right	ডান থেকে দ্বিতীয় রাইডারের হেডপিস
postage stamp with liberty bell	ডাকটিকেটে লিবার্টি বেল
Mud forms along the edge of the watering hole	জলের পাশে কাদা হয়েছে
an unfinished block of wood	কাঠের একটি অসম্পূর্ণ ব্লক
green grass behind players	খেলোয়াড়দের পিছনে সবুজ ঘাস
the second base coach watches the play	দ্বিতীয় বেস কোচ খেলাটি দেখেন
child's soft fine brown hair	বাচ্চার নরম সূক্ষ্ম বাদামী চুল
A black entertainment stand on wheels	একটি কালো বিনোদন স্ট্যান্ড চাকার উপর দাঁড়িয়ে 
fast motion image of woman walking in rain	বৃষ্টিতে হাঁটা মহিলার দ্রুত গতির চিত্র
second story of building holds two balconies	বাড়ির দ্বিতীয় তলায় দুটি বারান্দা 
ovan kept in the stand	ওভান স্ট্যান্ডে রাখা
The speaker on the stand	স্ট্যান্ডে স্পিকার
a man in front of a produce stand	একটি পণ্য উত্পাদন স্ট্যান্ডের সামনে একজন মানুষ
a fast moving train	একটি দ্রুত চলন্ত ট্রেন
tennis players shadow on court	কোর্টে টেনিস খেলোয়াড়ের ছায়া 
date stamp on photo is 8/23/08	ছবিতে তারিখ স্ট্যাম্প 8/23/08 হয়
a man sitting on a cement block	একজন সিমেন্টের ব্লকে বসে আছেন
several baseball players in the dugout	ডাগআউটে বেশ কয়েকটি বেসবল খেলোয়াড়
An orange time stamp	কমলা রঙের তারিখ স্ট্যাম্প 
the date is orange	তারিখ টি কমলা রঙের 
Grey block wall behind woman	মহিলার পিছনে ধূসর ব্লক প্রাচীর
english muffin with egg and hollandaise	ডিম এবং হল্যান্ডাইজের সাথে ইংলিশ মাফিন
tail of elephant forms a circle	হাতির লেজ একটি বৃত্ত গঠন করে
plant is on a metal stand	ধাতব স্ট্যান্ডের উপর গাছ
stand for trays	ট্রে এর স্ট্যান্ড 
this is a blue court	এটি একটি নীল কোর্ট
ginger with fair skin, orange hair, billions of freckles, and glasses	ফর্সা ত্বক, কমলা চুল, কোটি কোটি ফ্রিকলস এবং চশমাযুক্ত প্রানবন্ত ভাব 
facial expression, particularly mouth that says, 'yeah, i'm fine w/ being a corporate drone	মুখের অভিব্যক্তি, বিশেষত মুখটি বলে যে 'হ্যাঁ, আমি বড় কোম্পানির কর্মচারী হয়ে ভাল আছি' 
white block on the street	রাস্তায় সাদা ব্লক
boat forms ripples	নৌকা লহর ফর্ম
child forces straws into a a can	বাচ্ছাটি জোর করে ক্যান এর ভেতরে স্ট্র পুশ করে
Blue square on tennis court	টেনিস কোর্টে ব্লু স্কয়ার
the players tennis shoes are white	খেলোয়াড়দের টেনিস জুতো সাদা
sign denoting 2900 block	2900 ব্লকটি চিহ্নিত করুন sign
books in a black stand	একটি কালো স্ট্যান্ড বই
date and time of picture	তারিখ এবং ছবির সময়
a train stop block	একটি ট্রেন স্টপ ব্লক
Snow covered cross walk	তুষার ঢাকা ক্রস ওয়াক
the steeple has a cross on top	স্টিপলের উপরে একটি ক্রস রয়েছে
Soccer players in action	অ্যাকশনে সকার খেলোয়াড়রা
tennis court in bounds area for doubles play	ডাবল খেলার জন্য সীমান্ত অঞ্চলে টেনিস কোর্ট
english word in green	সবুজ ইংরেজি শব্দ
Brown tennis court with white lines.	সাদা লাইনে ব্রাউন ব্র্যান্ডের টেনিস কোর্ট।
A brown stand next to a wall.	একটি দেয়ালের পাশে একটি বাদামী স্ট্যান্ড।
black iron gate with white cross	সাদা ক্রস সঙ্গে কালো লোহার গেট
time stamp with red number	লাল নম্বর সহ সময় স্ট্যাম্প
stack of books on bed stand	বিছানা স্ট্যান্ড বইয়ের স্তুপ
knife set in a wooden block	একটি কাঠের ব্লক মধ্যে ছুরি সেট
base ball diamond with players	খেলোয়াড়দের নিয়ে বেসবল ডায়মন্ড
Television in the tv stand.	টিভি স্ট্যান্ডে টেলিভিশন।
second green sign from the top	উপরে থেকে দ্বিতীয় সবুজ চিহ্ন
Date stamp 6/30/2013	তারিখ স্ট্যাম্প 6/30/2013
logo on the tennis court	টেনিস কোর্টে লোগো
the necktie has a circle cross motif	নেকটি একটি বৃত্ত ক্রস মোটিফ আছে
a photographers stamp on the photo	ছবির উপর একটি ফটোগ্রাফার স্ট্যাম্প
block of green water in front of surfer	সার্ফারের সামনে সবুজ জলের ব্লক
asian characters in red	লাল এশিয়ান অক্ষর
A fine white sand	একটি সূক্ষ্ম সাদা বালি
night stand made of dark brown wood	গাঢ় বাদামী কাঠের তৈরি নাইট স্ট্যান্ড
two players in ground	মাটিতে দুই খেলোয়াড়
brown mane on neck of second giraffe	দ্বিতীয় জিরাফের গলায় বাদামি কেশর
white engraved cross	সাদা খোদাই করা ক্রস
Red and silver sign with Asian characters	এশীয় অক্ষরগুলির সাথে লাল এবং রৌপ্য সাইন
Woman getting ready to cross street	মহিলা রাস্তায় পার হতে প্রস্তুত
press board table top	টেবিলের উপর প্রেসবোর্ড
the train is a fast speed train	একটি দ্রুত গতির ট্রেন
People at a fair.	মেলায় লোকজন।
a metal cross beam	একটি ধাতব ক্রসবিম
players are playing baseball.	খেলোয়াড়রা বেসবল খেলছে।
railed porch on the second floor of a home	একটি বাড়ির দ্বিতীয় তলায় বারান্দা 
Balconies on the second floor	দ্বিতীয় তলায় বালকিনিগুলি
a plate with white characters	সাদা অক্ষরযুক্ত একটি প্লেট
The players wear uniforms.	খেলোয়াড়রা ইউনিফর্ম পরে।
photographers watermark and date	ফটোগ্রাফারদের জলছবি এবং তারিখ
Red table with fast food above it	এর উপরে ফাস্ট ফুড সহ লাল টেবিল
woman cross her arms	মেয়েটি হাত ভাঁজ করে
The tracks cross here	ট্র্যাকগুলি এখানে পার হয়
"orange ""do not cross"" sign"	"কমলা ""ক্রস করবেন না"" চিহ্ন"
A person standing at the food stand.	খাবার স্ট্যান্ডে দাঁড়িয়ে একজন ব্যক্তি।
Three players are wearing helmet.	তিনজন খেলোয়াড় হেলমেট পরেছেন।
a non english sign	একটি অ ইংরেজী সাইন
player running on court	খেলোয়াড় কোর্টে চলছে
the woman on the court	কোর্টে মহিলা
A round concert block	একটি বৃত্তাকার কনসার্ট ব্লক
fast food items on plates	প্লেটগুলিতে ফাস্ট ফুড আইটেম
Top window pane in the left corner of the second story window	দ্বিতীয় গল্পের উইন্ডোর বাম কোণে শীর্ষ উইন্ডো ফলক
boundary lines on court	কোর্টে সীমানা লাইন
second wooden vertical slat from left	বাম থেকে দ্বিতীয় কাঠের উল্লম্ব স্লট
A stand of trees along the edge of the lake	হ্রদের কিনারায় গাছের স্ট্যান্ড
a blue and white cross walk sign	একটি নীল এবং সাদা ক্রস ওয়াক সাইন
open door of a second bus	দ্বিতীয় বাসের দরজা খোলা
floral box springs under mattress	গদি অধীনে ফুলের বক্স স্প্রিংস
street sign advising of penalty	রাস্তার সাইন জরিমানার পরামর্শ
oranges and pears on the second layer of a fruit tree rack	একটি ফলের গাছের র্যাকের দ্বিতীয় স্তরে কমলা এবং নাশপাতি
A skier going down fast on a slope	একজন ierালুতে দ্রুত নেমে একটি স্কাইয়ার
an english saddle above a saddle pad	একটি স্যাডল প্যাডের উপরে একটি ইংরেজী স্যাডল
four shadowy forms of giraffes seemingly looking forward	জিরাফের চারটি ছায়াময় রূপগুলি আপাতদৃষ্টিতে অপেক্ষা করছে
dirty concrete wall behind players	খেলোয়াড়দের পিছনে নোংরা কংক্রিট প্রাচীর
a couple of elephants photoshopped to stand out	বাইরে দাঁড়িয়ে বেশ কয়েকটি হাতির ফটোশপ করলেন
The fast moving subway train	দ্রুত চলমান সাবওয়ে ট্রেন
the net between the two players	দুই খেলোয়াড়ের মধ্যে নেট
Baseball glove on players left hand	খেলোয়াড়দের বাম হাতে বেসবল গ্লোভ
silver and black french coffee press on shelf	বালুচর উপর সিলভার এবং কালো ফরাসি কফি প্রেস
grey block in sidewalk	ফুটপাতে ধূসর ব্লক
short tan entertainment stand	সংক্ষিপ্ত ট্যান বিনোদন স্ট্যান্ড
A wooden block holding up the boat	একটি কাঠের ব্লক যা নৌকাকে চেপে ধরে
fence next to players	খেলোয়াড়দের পাশে বেড়া
Oranges on a fruit stand	ফলের স্ট্যান্ডে কমলা
a butcher block with knives	ছুরি দিয়ে কসাই ব্লক
Cluttered night stand	বিশৃঙ্খলা নাইট স্ট্যান্ড
tan house with lighter colored second floor	হালকা রঙ্গিন দ্বিতীয় তল সঙ্গে ট্যান ঘর
two white chairs on tennis court	টেনিস কোর্টে দুটি সাদা চেয়ার
a cross railway sign	একটি ক্রস রেলওয়ে সাইন
a triangle forms on brick	একটি ত্রিভুজ ইট উপর ফর্ম
A fast boat with people in it	এতে লোকজনের সাথে একটি দ্রুত নৌকা
People waiting to cross street.	রাস্তা পার হওয়ার অপেক্ষায় থাকা মানুষ।
the button to press for the light is below the signal	আলোর জন্য চাপতে বোতামটি সিগন্যালের নীচে
dirt ground elephants stand on	ময়লা গ্রাউন্ড হাতি দাঁড়িয়ে আছে
the springs on the motorcycle	মোটরসাইকেলের ঝর্ণা
marked pedestrian cross walk	পথচারী ক্রস ওয়াক চিহ্নিত
The water is flowing fast	জল দ্রুত প্রবাহিত হয়
The word AUG in the date	তারিখের এওজি শব্দটি
wooden slat that forms back of bench.	কাঠের স্লট যা বেঞ্চের পিছনে গঠন করে।
the two male players are after the ball	দুই পুরুষ খেলোয়াড় বল পরে আছেন
power lines cross in the air	শক্তি লাইন বাতাসে অতিক্রম
area next to pot stand	পট স্ট্যান্ডের পাশের অঞ্চল
fast food in the backgrond	ব্যাকগ্রাউন্ডে ফাস্টফুড
this is a concrete yellow block	এটি একটি কংক্রিট হলুদ ব্লক
shadow on tennis court.	টেনিস কোর্টে ছায়া।
tennis court marked with white color	টেনিস কোর্ট সাদা রঙের সাথে চিহ্নিত
a green Christmas tree stand	সবুজ ক্রিসমাস ট্রি স্ট্যান্ড
a business man waiting to cross the street	একজন ব্যবসায়ী লোক রাস্তা পার হওয়ার অপেক্ষায়
A white stand mixer	একটি সাদা স্ট্যান্ড মিশুক
The time stamp is red.	সময় স্ট্যাম্প লাল।
cross section of a broccoli stem	একটি ব্রোকলি স্টেম ক্রস বিভাগ
players in the dugout.	খেলোয়াড়
a green fence at a tennis court	টেনিস কোর্টে সবুজ বেড়া
person playing tennis on the court	ব্যক্তি কোর্টে টেনিস খেলছে
Man trying to block the throwing of a frisbee	মানুষ একটি ফ্রিসবি নিক্ষেপ করার চেষ্টা করছে
the balcony on the second floor	দ্বিতীয় তলায় বারান্দা
Red dragon fruit on a fruit stand.	একটি ফলের স্ট্যান্ডে লাল ড্রাগন ফল।
person setting in second seat of bus	ব্যক্তি বাসের দ্বিতীয় সিটে বসছে
The body of the stand up lamp.	দেহের স্ট্যান্ড আপ ল্যাম্প।
The players are male.	খেলোয়াড়রা পুরুষ।
A fence at a tennis court	টেনিস কোর্টে একটি বেড়া
the date says 7-1	তারিখটি 7-1 বলে
picture hanging in the wall with anime characters	এনিমে অক্ষরগুলির সাথে দেয়ালে ঝুলন্ত ছবি
a grill press	একটি গ্রিল প্রেস
Bird models suspended in shopping mall.	শপিং মলে বার্ড মডেলগুলি স্থগিত করা হয়েছে।
green wall on tennis court	টেনিস কোর্টে সবুজ প্রাচীর
Woman in an english style saddle	মহিলা একটি ইংলিশ স্টাইলের স্যাডলে
Photo date stamp	ছবির তারিখ স্ট্যাম্প
the copyright and date stamp of the photographer	ফটোগ্রাফারের কপিরাইট এবং তারিখ স্ট্যাম্প
a man stand on dock	একজন লোক ডকের উপরে দাঁড়িয়ে আছে
two players wearing white shorts	সাদা শর্টস পরা দুই খেলোয়াড়
People on the court playing tennis.	টেনিস খেলে কোর্টে লোকেরা।
A blue fine on the surf board.	সার্ফ বোর্ডে একটি নীল জরিমানা।
White potted flowers on the tennis court	টেনিস কোর্টে সাদা পাত্র ফুল
a toasted english muffin	একটি টোস্টড ইংলিশ মাফিন
Baseball player stealing second base	বেসবল খেলোয়াড় দ্বিতীয় বেস চুরি
a date stamp for 2010/02/07	2010/02/07 এর জন্য একটি তারিখ স্ট্যাম্প
second story of house	বাড়ির দ্বিতীয় গল্প
Blue cross window on second floor	দ্বিতীয় তলায় নীল ক্রস উইন্ডো
bird characters on top of a brown cake	একটি বাদামী পিষ্টকের উপরে পাখির অক্ষর
a advertisement for highland springs	পার্বত্য অঞ্চলের ঝর্ণা জন্য একটি বিজ্ঞাপন
the tennis court is made of grass	টেনিস কোর্ট ঘাস দিয়ে তৈরি
a line of runway models	রানওয়ে মডেলগুলির একটি লাইন
yellow numbers showing the date	হলুদ সংখ্যা তারিখ দেখাচ্ছে
A women skiing fast.	একজন মহিলা দ্রুত স্কিইং করছেন।
cross country ski racers skiing up a hill.	ক্রস কান্ট্রি স্কি রেসাররা একটি পাহাড়ের উপরে স্কিইং করছে।
Three women soccer players sitting on a bench.	তিনজন মহিলা ফুটবল খেলোয়াড় একটি বেঞ্চে বসে।
decaying amazing building that looks like something between an aztec and buddhist shrine in the english countryside	ক্ষয়িষ্ণু বিস্ময়কর বিল্ডিং যা দেখতে ইংরাজির পল্লীতে অ্যাজটেক এবং বৌদ্ধবাদী মাজারের মাঝে কিছু মনে হচ্ছে
A pot is fitted in a stand.	একটি স্ট্যান্ডে একটি পাত্র লাগানো হয়।
Safety railing on second story of building	বিল্ডিংয়ের দ্বিতীয় গল্পের সুরক্ষা রেলিং
Man sits floor cross legged	মানুষ মেঝে ক্রস পায়ে বসে
White writing on a blue court.	নীল দরবারে সাদা লেখা।
a very fast baseball	খুব দ্রুত বেসবল
White clock face with brown characters	বাদামী বর্ণের সাথে সাদা ঘড়ির মুখ
buildings are behind the road block	রোড ব্লকের পিছনে ভবনগুলি
Young woman in grey sweatshirt hoping to block frisbee.	ফ্রিসবি ব্লক করার আশায় ধূসর সোয়েটশার্টে যুবতী।
people on the second floor	দ্বিতীয় তলায় মানুষ
a red dirt tennis court	একটি লাল ময়লা টেনিস কোর্ট
Black block with number on it	এটিতে নম্বর সহ ব্লক ব্লক
stuffed disney characters	স্টাফ ডিজনি অক্ষর
players waiting in dugout	খেলোয়াড় dugout মধ্যে অপেক্ষা
baseball players white pants	বেসবল খেলোয়াড় সাদা প্যান্ট
A motorcycle kick stand.	একটি মোটরসাইকেলের কিক স্ট্যান্ড।
There is some fine sand here	এখানে কিছু সূক্ষ্ম বালি আছে
a metal orange juice press	একটি ধাতব কমলা রস প্রেস
a baseball players uniform	একটি বেসবল খেলোয়াড় ইউনিফর্ম
Three baseball players on baseball field.	বেসবল মাঠে তিন বেসবল খেলোয়াড়।
Booths at a street fair.	রাস্তার মেলায় বুথ।
Back right foot of the second goat	দ্বিতীয় ছাগলের ডান পা পিছনে
fine toothed blade of knife	ছুরি জরিমানা দাঁতযুক্ত ফলক
guy's hand trying to block the camera	লোকটির হাত ক্যামেরাটি ব্লক করার চেষ্টা করছে
Baseball in players right hand	খেলোয়াড়দের ডান হাতে বেসবল
The second highest rail of the jump	লাফের দ্বিতীয় সর্বোচ্চ রেল
a white paper not in english	একটি সাদা কাগজ ইংরেজি না
green and white concession stand near umbrella	ছাতার কাছাকাছি সবুজ এবং সাদা ছাড়
metal stand for ropes	দড়ি দড়ি জন্য স্ট্যান্ড
an umbrella standing in a tennis court	টেনিস কোর্টে একটি ছাতা দাঁড়িয়ে আছে
there are english and Chinese characters	ইংরেজি এবং চীনা অক্ষর আছে
a bench along a tennis court	টেনিস কোর্ট বরাবর একটি বেঞ্চ
a young girl with a fair complexion	একটি ফর্সা বর্ণের সঙ্গে একটি যুবা মেয়ে
The players uniform is white	খেলোয়াড়দের ইউনিফর্ম সাদা
a motorcycle side stand	মোটরসাইকেলের সাইড স্ট্যান্ড
The second clock showing on the tower.	টাওয়ারে দেখানো দ্বিতীয় ঘড়ি।
tennis court floor	টেনিস কোর্ট ফ্লোর
cross on top of steeple	স্টেপল উপর ক্রস
the players are on a field	খেলোয়াড়রা একটি মাঠে আছে
the second car in the train	ট্রেনের দ্বিতীয় গাড়ি
A TV stand sitting under TV	টিভির নিচে বসে একটি টিভি স্ট্যান্ড
two young softball players sitting on the bench	দুই তরুণ সফটবল খেলোয়াড় বেঞ্চে বসে আছেন
man on a tennis court on a sunny day	টেনিস কোর্টে এক রোদ রোজ মানুষ
mass sheep and woolcraft fair ribbon	ভর মেষ এবং উলক্রাফট মেলা ফিতা
the combs are fine	ঝুঁটি ভাল আছে
cap on players head	খেলোয়াড়দের মাথায় ক্যাপ
the models are red and black	মডেলগুলি লাল এবং কালো
Green and red tennis court	সবুজ এবং লাল টেনিস কোর্ট
a celtic cross stone monument	একটি সেল্টিক ক্রস পাথর স্মৃতিস্তম্ভ
plants behind toy models	খেলনা মডেল পিছনে গাছপালা
wave is moving fast	তরঙ্গ দ্রুত গতিতে চলছে
red double decker bus with Chinese characters and number 8	চীনা অক্ষর এবং 8 নম্বর সহ লাল ডাবল ডেকার বাস
this shop sells fine ales	এই দোকান জরিমানা বিক্রি করে
orange street block	কমলা স্ট্রিট ব্লক
cross section of fans at baseball game	বেসবল খেলায় ভক্তদের ক্রস বিভাগ
